{
  "schemaVersion": 1,
  "trip": {
    "id": "california-2026",
    "title": "Baltimore → California",
    "subtitle": "LA, the Pacific Coast Highway, redwoods & San Francisco",
    "startDate": "2026-10-05",
    "endDate": "2026-10-13",
    "dateLabel": "Early–mid October 2026",
    "party": "2 adults",
    "homeBases": [
      { "city": "Los Angeles", "area": "Mid-Wilshire / West Hollywood", "nights": 4 },
      { "city": "Central Coast", "area": "Cambria", "nights": 1 },
      { "city": "San Francisco", "area": "Nob Hill", "nights": 3 }
    ],
    "notes": "Open-jaw: fly into LAX, home from SFO. Carry-on only. Comfortable gas/hybrid crossover; not an EV."
  },
  "days": [
    {
      "n": 1,
      "date": "2026-10-05",
      "segment": "LA",
      "label": "Arrive",
      "title": "Land, grab the car, ease in",
      "beats": [
        { "time": "Afternoon", "text": "Fly BWI → LAX. Pick up the rental at the airport, drive to the Mid-Wilshire / WeHo hotel (~30–45 min)." },
        { "time": "Evening", "text": "Easy neighborhood dinner — tacos at Sonoratown or a bowl at Kismet — and an early night to reset the clock." }
      ],
      "fuel": "First morning coffee: Go Get Em Tiger or Maru Coffee."
    },
    {
      "n": 2,
      "date": "2026-10-06",
      "segment": "LA",
      "label": "Los Angeles",
      "title": "The Getty by day, Griffith at dusk",
      "beats": [
        { "time": "Morning", "text": "The Getty Center — tram up the hill, gardens, the collection, the view. Give it a solid half day." },
        { "time": "Afternoon", "text": "Late lunch, reset at the hotel. Optionally LACMA or a wander down Melrose." },
        { "time": "Dusk", "text": "Griffith Observatory — arrive before sunset for city + Hollywood-sign views, stay for the lights." }
      ],
      "fuel": "Mid-day break: coffee + a bite at République (La Brea) or Alfred (Melrose Place)."
    },
    {
      "n": 3,
      "date": "2026-10-07",
      "segment": "LA",
      "label": "Los Angeles",
      "title": "Universal Studios — the full day",
      "beats": [
        { "time": "Morning", "text": "Rope-drop it. Studio Tour first, then headline rides before lines build." },
        { "time": "All day", "text": "Pace yourself; the park is up in the Valley (~25 min). Express Pass worth it if crowds are heavy." },
        { "time": "Evening", "text": "Wind down at CityWalk or head back for a low-key dinner near the hotel." }
      ],
      "fuel": "Caffeinate before you go at Maru or Cafe Dulce — park coffee is mediocre."
    },
    {
      "n": 4,
      "date": "2026-10-08",
      "segment": "LA",
      "label": "Los Angeles",
      "title": "A beach walk and a proper eating day",
      "beats": [
        { "time": "Morning", "text": "Drive to El Matador State Beach in Malibu — coves, sea stacks, a genuinely pretty walk." },
        { "time": "Midday", "text": "Grand Central Market downtown — graze: tacos, egg sandwiches, Thai, pastries." },
        { "time": "Evening", "text": "One nice LA dinner: Bestia (Arts District — book ahead), or splurge on the n/naka tasting menu." }
      ],
      "fuel": "Afternoon coffee: Gjusta or Great White in Venice; Verve on Melrose back in town. Food worth the detour: Langer's #19 pastrami (lunch), Guelaguetza, Howlin' Ray's."
    },
    {
      "n": 5,
      "date": "2026-10-09",
      "segment": "DRIVE",
      "label": "LA → Cambria · ~5 hr + stops",
      "title": "Up the coast to Cambria",
      "beats": [
        { "time": "Morning", "text": "Roll out early. First stop Santa Barbara — stretch, coffee, maybe brunch." },
        { "time": "Midday", "text": "Push north through the Central Coast. Optional: Hearst Castle tour (pre-book) or wine detour near SLO." },
        { "time": "Afternoon", "text": "Piedras Blancas elephant seal rookery — right off the highway, free. Then check into Cambria." },
        { "time": "Evening", "text": "Sunset stroll on Moonstone Beach, dinner in the village, olallieberry pie at Linn's." }
      ],
      "fuel": "Handlebar Coffee or Helena Avenue Bakery in Santa Barbara; Cambria Coffee Roasting Co. on arrival."
    },
    {
      "n": 6,
      "date": "2026-10-10",
      "segment": "DRIVE",
      "label": "Cambria → SF · ~6 hr + stops",
      "title": "Big Sur, the redwoods, into the city",
      "beats": [
        { "time": "Morning", "text": "The showstopper stretch: Ragged Point, Bixby Creek Bridge, McWay Falls. Pull over often." },
        { "time": "Lunch", "text": "Nepenthe in Big Sur — cliffside terrace, famous view. Or Big Sur Bakery further on." },
        { "time": "Afternoon", "text": "REDWOODS #1: Henry Cowell Redwoods loop near Santa Cruz — ancient coast redwoods, easy flat walk, on the route." },
        { "time": "Evening", "text": "Into San Francisco, check into Nob Hill. Keep dinner simple — you've earned an easy one." }
      ],
      "fuel": "Café Kevah at Nepenthe for the view; Verve Coffee flagship in Santa Cruz for the last leg. If low on energy, skip the redwood stop — Muir Woods is lined up tomorrow."
    },
    {
      "n": 7,
      "date": "2026-10-11",
      "segment": "SF",
      "label": "San Francisco",
      "title": "The bridge and the big trees",
      "beats": [
        { "time": "Morning", "text": "REDWOODS #2: Muir Woods, ~40 min north over the Golden Gate. Go early, reservation in hand." },
        { "time": "Midday", "text": "Golden Gate Bridge vista on the way back — Battery Spencer on the Marin side for the classic shot." },
        { "time": "Afternoon", "text": "Lands End coastal trail, or the Palace of Fine Arts + a wander through the Marina." },
        { "time": "Evening", "text": "One nice SF dinner: Zuni Café (the roast chicken) or State Bird Provisions (book ahead)." }
      ],
      "fuel": "Saint Frank on Russian Hill or Réveille. Old-school: an espresso at Caffe Trieste in North Beach."
    },
    {
      "n": 8,
      "date": "2026-10-12",
      "segment": "SF",
      "label": "San Francisco",
      "title": "Waterfront, the Rock, and eating around town",
      "beats": [
        { "time": "Morning", "text": "Ferry Building Marketplace — oysters, Cowgirl cheese, coffee, the farmers' market if it's a market day." },
        { "time": "Midday", "text": "Alcatraz (pre-booked) — the audio tour is gripping. About a half day with the ferry." },
        { "time": "Afternoon", "text": "Fisherman's Wharf + Pier 39 sea lions, then North Beach and Chinatown. Cable car back up Nob Hill." },
        { "time": "Evening", "text": "Casual and iconic: a Mission burrito at La Taqueria, or dim sum / North Beach Italian." }
      ],
      "fuel": "Don't-miss bites: Swan Oyster Depot (counter, lunch), Tartine for pastries, Golden Boy pizza in North Beach."
    },
    {
      "n": 9,
      "date": "2026-10-13",
      "segment": "SF",
      "label": "Depart",
      "title": "One last coffee, then home",
      "beats": [
        { "time": "Morning", "text": "Final bakery run, or the Painted Ladies at Alamo Square. Drop the car at SFO." },
        { "time": "Midday", "text": "Fly SFO → BWI. Carry-on only means a relaxed, no-baggage-claim exit." }
      ],
      "fuel": "Last coffee: Mr. Holmes Bakehouse or b. Patisserie before the airport."
    }
  ],
  "reservations": [
    { "type": "flight", "name": "BWI → LAX", "confirmation": "", "datetime": "2026-10-05", "address": "Baltimore/Washington (BWI)", "phone": "", "notes": "Premium economy. Outbound." },
    { "type": "hotel", "name": "LA hotel (Mid-Wilshire / WeHo)", "confirmation": "", "datetime": "2026-10-05 to 2026-10-09", "address": "", "phone": "", "notes": "4 nights. 3★+." },
    { "type": "tour", "name": "Universal Studios Hollywood", "confirmation": "", "datetime": "2026-10-07", "address": "100 Universal City Plaza, Universal City", "phone": "", "notes": "Dated ticket. Consider Express Pass." },
    { "type": "hotel", "name": "Cambria hotel", "confirmation": "", "datetime": "2026-10-09 to 2026-10-10", "address": "Moonstone Beach Dr, Cambria", "phone": "", "notes": "1 night." },
    { "type": "tour", "name": "Muir Woods parking / shuttle", "confirmation": "", "datetime": "2026-10-11", "address": "1 Muir Woods Rd, Mill Valley", "phone": "", "notes": "Timed reservation is MANDATORY." },
    { "type": "tour", "name": "Alcatraz ferry + tour", "confirmation": "", "datetime": "2026-10-12", "address": "Pier 33, San Francisco", "phone": "", "notes": "Sells out weeks ahead — book first." },
    { "type": "hotel", "name": "SF hotel (Nob Hill)", "confirmation": "", "datetime": "2026-10-10 to 2026-10-13", "address": "", "phone": "", "notes": "3 nights." },
    { "type": "flight", "name": "SFO → BWI", "confirmation": "", "datetime": "2026-10-13", "address": "San Francisco (SFO)", "phone": "", "notes": "Premium economy. Return." }
  ],
  "checklists": [
    {
      "name": "Book these early",
      "items": [
        "Flights — open-jaw BWI→LAX / SFO→BWI, premium economy (2–3 mo out)",
        "Alcatraz tickets (4–8 wk out — the true sellout)",
        "Universal Studios dated tickets (+ Express Pass?)",
        "Muir Woods timed parking/shuttle reservation",
        "Bestia (LA) + SF dinner (Zuni / State Bird); n/naka if splurging",
        "Getty parking reservation; Hearst Castle tour if adding",
        "Rental car — one-way LAX pickup, SFO drop"
      ]
    },
    {
      "name": "Packing (carry-on only)",
      "items": [
        "Layers — SF mornings & Big Sur are cool/foggy",
        "Comfortable walking shoes",
        "Light rain shell (just in case)",
        "Sunglasses + sunscreen",
        "Phone car mount + charging cable for the drive",
        "Reusable water bottles",
        "Chargers / power bank",
        "Downloaded Google Maps offline area for Big Sur"
      ]
    }
  ]
}
